{"actor_id":"CREED","caused_by":null,"command_id":"CMD-019305f8-ec00-7000-8000-000000000104","command_type":"SubmitForecast","correlation_id":"gate-c-increment2-creed","depends_on":["CMD-019305f8-ec00-7000-8000-000000000103"],"expected_version":0,"native_refs":[{"locator":"Pred_ID=PRED-CREED-004","locator_type":"TSV_RECORD_ID","path":"AGENTS/CREED/workbook/PREDICTIONS.tsv","raw_record_sha256":"2607de9e28d9ca75be488589350f03601270a2230eeb72ae6dd3dd87a722f394","repository":"williepowen-debug/Research-workspace","source_commit":"8326b5ce15fc31ca4ddb11298c2f021dc70fc246"}],"payload":{"decision_consequence":"Signal-only test of the S8b CRE-lender-capital-withdrawal channel and an input to CREED-T-08b, whose own band additionally requires realized book erosion across the cohort. It does not authorize a trade, does not by itself fire T-08b, and does not move the S8b score.","evidence_refs":["AGENTS/CREED/workbook/VX.tsv#VX-CREED-10.01","AGENTS/CREED/registry/THRESHOLDS.tsv#CREED-T-08b","AGENTS/CREED/workbook/PREDICTIONS.tsv#Pred_ID=PRED-CREED-004"],"forecast_id":"F-019305f8-ec00-7000-8000-000000000103","forecast_version":1,"forecaster_actor_id":"CREED","information_as_of":"2026-07-27T00:00:00.000000Z","intervention_stage":"INITIAL","probability":0.6,"question_id":"Q-019305f8-ec00-7000-8000-000000000103","rationale_ref":"AGENTS/CREED/workbook/PREDICTIONS.tsv#Pred_ID=PRED-CREED-004"},"policy_version":"kernel.policy.1","schema_version":"kernel.schema.1","submitted_at":"2026-08-27T20:49:52.343299Z","target_stream_id":"FS-F-019305f8-ec00-7000-8000-000000000103"}
